{
  "schemaVersion": "0.1.0",
  "assetDraftId": "CC-AD-MATERIAL-DEMO-001",
  "draftVersion": "0.1.0",
  "title": "Recycled composite shell demonstration",
  "assetType": "material",
  "summary": "Synthetic Asset Lab fixture for a recovered-fibre composite product shell.",
  "status": "draft",
  "ownerCreatorId": "CC-CR-DEMO-MOLECULAR-001",
  "componentRefs": ["CC-AC-SHELL-DEMO-001"],
  "materialSpecificationRefs": ["CC-MS-RECYCLED-COMPOSITE-001"],
  "processRecipeRefs": ["CC-PR-COMPRESSION-DEMO-001"],
  "variantRefs": ["CC-AV-HIGH-RECYCLED-001"],
  "validationRunRefs": ["CC-VR-FLEXURAL-DEMO-001"],
  "claimRefs": ["CC-CL-RECYCLED-CONTENT-001"],
  "releaseGateRefs": ["CC-RG-PROTOTYPE-DEMO-001"],
  "workspace": {
    "activeLab": "material",
    "canvasMode": "graph",
    "lastSavedBy": "CC-CR-DEMO-MOLECULAR-001",
    "lastSavedAt": "2026-07-14T09:30:00Z"
  },
  "visibility": "public",
  "issuer": {
    "issuerId": "CC-INST-CREATORS-COMMON",
    "name": "Creators Common",
    "authorityRef": "docs/product/CC-ASSET-LAB-PRD-V0.1.md"
  },
  "createdAt": "2026-07-14T09:30:00Z",
  "updatedAt": "2026-07-14T09:30:00Z"
}
